{
  "$schema": "https://json-schema.org/draft/2020-12/schema",
  "$id": "https://github.com/WhiteChronos/ChatGPT/schemas/aut_panel_project_v1.schema.json",
  "title": "AUT Panel Project",
  "type": "object",
  "additionalProperties": false,
  "required": [
    "schema_version",
    "project",
    "production_contract",
    "enclosure",
    "render",
    "views",
    "layout",
    "architecture",
    "placements",
    "normative_profile"
  ],
  "properties": {
    "schema_version": {
      "const": "1.1"
    },
    "project": {
      "type": "object",
      "additionalProperties": false,
      "required": [
        "id",
        "title",
        "revision",
        "engineering_level",
        "standard_id"
      ],
      "properties": {
        "id": {
          "type": "string",
          "minLength": 1
        },
        "title": {
          "type": "string",
          "minLength": 1
        },
        "revision": {
          "type": "string",
          "pattern": "^R[0-9]{2}$"
        },
        "engineering_level": {
          "enum": [
            "CONCEPTUAL",
            "BASIC",
            "EXECUTIVE"
          ]
        },
        "standard_id": {
          "const": "AUT-PAINEL-COMPACT-V2.4"
        }
      }
    },
    "production_contract": {
      "type": "object",
      "additionalProperties": false,
      "required": [
        "golden_rules",
        "li_file",
        "quantity_registry",
        "document_standard_registry",
        "immutable_golden_rules_registry",
        "immutable_pipeline_registry",
        "panel_template_registry",
        "datacenter_yaml_registry",
        "datasheet_yaml_registry",
        "prompt_master_file",
        "prompt_master_id",
        "li_before_bom",
        "li_is_quantity_source",
        "load_balance_before_layout",
        "bom_before_render",
        "bom_quantity_must_match_li",
        "layout_quantity_must_match_li",
        "image_must_match_li",
        "li_change_invalidates_bom_layout_image",
        "hmi_must_be_on_door",
        "workbook_template_id",
        "workbook_structural_fingerprint_sha256",
        "workbook_template_must_match_master",
        "image_visual_standard_id",
        "image_template_id",
        "approved_image_sha256",
        "image_template_must_match_approved",
        "one_panel_per_image",
        "standard_change_requires_explicit_authorization",
        "normative_registry",
        "normative_memory",
        "normative_registry_id",
        "normative_memory_id",
        "normative_reverification_before_release",
        "normative_unverified_applicable_status"
      ],
      "properties": {
        "golden_rules": {
          "type": "array",
          "items": {
            "type": "string"
          },
          "allOf": [
            {
              "contains": {
                "const": "GR-035"
              }
            },
            {
              "contains": {
                "const": "GR-039"
              }
            },
            {
              "contains": {
                "const": "GR-040"
              }
            },
            {
              "contains": {
                "const": "GR-041"
              }
            },
            {
              "contains": {
                "const": "GR-042"
              }
            },
            {
              "contains": {
                "const": "GR-043"
              }
            },
            {
              "contains": {
                "const": "GR-044"
              }
            },
            {
              "contains": {
                "const": "GR-045"
              }
            }
          ]
        },
        "li_file": {
          "type": "string",
          "minLength": 1
        },
        "quantity_registry": {
          "const": "datacenter/AUT_PANEL_PANEL_QUANTITIES.json"
        },
        "document_standard_registry": {
          "const": "datacenter/AUT_PANEL_DOCUMENT_STANDARDS.json"
        },
        "immutable_golden_rules_registry": {
          "const": "governance/golden_rules.yaml"
        },
        "immutable_pipeline_registry": {
          "const": "pipeline/pipeline.yaml"
        },
        "panel_template_registry": {
          "const": "templates/panel_template.yaml"
        },
        "datacenter_yaml_registry": {
          "const": "datacenter/datacenter.yaml"
        },
        "datasheet_yaml_registry": {
          "const": "datasheet/datasheet.yaml"
        },
        "prompt_master_file": {
          "const": "prompts/PROMPT_MASTER_AUT_PANEL.md"
        },
        "prompt_master_id": {
          "const": "PROMPT-MASTER-AUT-PANEL-V1"
        },
        "li_before_bom": {
          "const": true
        },
        "li_is_quantity_source": {
          "const": true
        },
        "load_balance_before_layout": {
          "const": true
        },
        "bom_before_render": {
          "const": true
        },
        "bom_quantity_must_match_li": {
          "const": true
        },
        "layout_quantity_must_match_li": {
          "const": true
        },
        "image_must_match_li": {
          "const": true
        },
        "li_change_invalidates_bom_layout_image": {
          "const": true
        },
        "hmi_must_be_on_door": {
          "const": true
        },
        "workbook_template_id": {
          "const": "XLSX-PN-AUT-01-MASTER-R02"
        },
        "workbook_structural_fingerprint_sha256": {
          "const": "c568858ed6d80cc2ccd4a8859d0a21f88cafddccc10737eda8808555b94530fc"
        },
        "workbook_template_must_match_master": {
          "const": true
        },
        "image_visual_standard_id": {
          "const": "IMG-AUT-PANEL-MASTER-V1"
        },
        "image_template_id": {
          "type": "string",
          "pattern": "^IMG-PN-AUT-0[12]-APPROVED-V1$"
        },
        "approved_image_sha256": {
          "type": "string",
          "pattern": "^[0-9a-f]{64}$"
        },
        "image_template_must_match_approved": {
          "const": true
        },
        "one_panel_per_image": {
          "const": true
        },
        "standard_change_requires_explicit_authorization": {
          "const": true
        },
        "normative_registry": {
          "const": "datacenter/AUT_PANEL_NORMATIVE_REFERENCES.yaml"
        },
        "normative_memory": {
          "const": "memory/AUT_PANEL_NORMATIVE_MEMORY.yaml"
        },
        "normative_registry_id": {
          "const": "AUT-PANEL-NORMATIVE-REFERENCES-V1"
        },
        "normative_memory_id": {
          "const": "AUT-PANEL-NORMATIVE-MEMORY-V1"
        },
        "normative_reverification_before_release": {
          "const": true
        },
        "normative_unverified_applicable_status": {
          "const": "HOLD"
        }
      }
    },
    "enclosure": {
      "type": "object",
      "additionalProperties": false,
      "required": [
        "catalog_id",
        "manufacturer",
        "family",
        "model",
        "external_mm",
        "mounting_plate_mm",
        "minimum_free_reserve_percent"
      ],
      "properties": {
        "catalog_id": {
          "type": "string",
          "minLength": 1
        },
        "manufacturer": {
          "type": "string"
        },
        "family": {
          "type": "string"
        },
        "model": {
          "type": "string"
        },
        "external_mm": {
          "$ref": "#/$defs/box3d"
        },
        "mounting_plate_mm": {
          "$ref": "#/$defs/box2d"
        },
        "minimum_free_reserve_percent": {
          "type": "number",
          "minimum": 0,
          "maximum": 80
        },
        "ip_rating": {
          "type": [
            "string",
            "null"
          ]
        },
        "ik_rating": {
          "type": [
            "string",
            "null"
          ]
        }
      }
    },
    "render": {
      "type": "object",
      "additionalProperties": false,
      "required": [
        "px_per_mm",
        "single_global_scale",
        "aspect_equal",
        "allow_component_scale_override",
        "allow_stretch",
        "canvas_policy",
        "front_external_master_geometry",
        "visual_standard_id",
        "visual_template_id",
        "one_panel_per_image",
        "approved_reference_layout_locked"
      ],
      "properties": {
        "px_per_mm": {
          "type": "number",
          "exclusiveMinimum": 0
        },
        "single_global_scale": {
          "const": true
        },
        "aspect_equal": {
          "const": true
        },
        "allow_component_scale_override": {
          "const": false
        },
        "allow_stretch": {
          "const": false
        },
        "canvas_policy": {
          "const": "grow_only"
        },
        "front_external_master_geometry": {
          "const": true
        },
        "visual_standard_id": {
          "const": "IMG-AUT-PANEL-MASTER-V1"
        },
        "visual_template_id": {
          "type": "string",
          "pattern": "^IMG-PN-AUT-0[12]-APPROVED-V1$"
        },
        "one_panel_per_image": {
          "const": true
        },
        "approved_reference_layout_locked": {
          "const": true
        }
      }
    },
    "views": {
      "type": "object",
      "additionalProperties": false,
      "required": [
        "front_external_mm",
        "front_internal_mm",
        "side_external_mm"
      ],
      "properties": {
        "front_external_mm": {
          "$ref": "#/$defs/box2d"
        },
        "front_internal_mm": {
          "$ref": "#/$defs/box2d"
        },
        "side_external_mm": {
          "$ref": "#/$defs/box2d"
        }
      }
    },
    "layout": {
      "type": "object",
      "additionalProperties": false,
      "required": [
        "bottom_zone",
        "fixed_occupied_area_mm2"
      ],
      "properties": {
        "fixed_occupied_area_mm2": {
          "type": "number",
          "minimum": 0
        },
        "bottom_zone": {
          "type": "object",
          "additionalProperties": false,
          "required": [
            "cable_exit_height_mm",
            "lower_wireway_height_mm",
            "minimum_bend_clearance_mm",
            "terminal_zone_bottom_y_mm",
            "cable_glands_count"
          ],
          "properties": {
            "cable_exit_height_mm": {
              "type": "number",
              "minimum": 0
            },
            "lower_wireway_height_mm": {
              "type": "number",
              "minimum": 0
            },
            "minimum_bend_clearance_mm": {
              "type": "number",
              "minimum": 0
            },
            "terminal_zone_bottom_y_mm": {
              "type": "number",
              "minimum": 0
            },
            "cable_glands_count": {
              "type": "integer",
              "minimum": 0
            }
          }
        }
      }
    },
    "architecture": {
      "type": "object",
      "additionalProperties": false,
      "required": [
        "controller_type",
        "controller_catalog_id",
        "io_catalog_ids",
        "protocols"
      ],
      "properties": {
        "controller_type": {
          "enum": [
            "RTU",
            "PLC",
            "PAC"
          ]
        },
        "controller_catalog_id": {
          "type": "string"
        },
        "io_catalog_ids": {
          "type": "array",
          "items": {
            "type": "string"
          },
          "uniqueItems": true
        },
        "protocols": {
          "type": "array",
          "items": {
            "type": "string"
          },
          "uniqueItems": true
        }
      }
    },
    "placements": {
      "type": "array",
      "items": {
        "type": "object",
        "additionalProperties": false,
        "required": [
          "li_tag",
          "instance_id",
          "catalog_id",
          "quantity",
          "surface",
          "x_mm",
          "y_mm",
          "rotation_deg"
        ],
        "properties": {
          "li_tag": {
            "type": "string",
            "minLength": 1
          },
          "instance_id": {
            "type": "string",
            "minLength": 1
          },
          "catalog_id": {
            "type": "string",
            "minLength": 1
          },
          "quantity": {
            "type": "integer",
            "minimum": 1
          },
          "surface": {
            "enum": [
              "mounting_plate",
              "door"
            ]
          },
          "x_mm": {
            "type": "number",
            "minimum": 0
          },
          "y_mm": {
            "type": "number",
            "minimum": 0
          },
          "rotation_deg": {
            "enum": [
              0,
              90,
              180,
              270
            ]
          }
        }
      }
    },
    "normative_profile": {
      "type": "object",
      "additionalProperties": false,
      "required": [
        "baseline_group",
        "detected_conditions",
        "conditional_group_review_required",
        "applicability_status",
        "note"
      ],
      "properties": {
        "baseline_group": {
          "const": "panel_general"
        },
        "detected_conditions": {
          "type": "array",
          "items": {
            "type": "string"
          },
          "uniqueItems": true
        },
        "conditional_group_review_required": {
          "const": true
        },
        "applicability_status": {
          "const": "HOLD_UNTIL_NORMATIVE_REVIEW"
        },
        "note": {
          "type": "string",
          "minLength": 1
        }
      }
    }
  },
  "$defs": {
    "box2d": {
      "type": "object",
      "additionalProperties": false,
      "required": [
        "width",
        "height"
      ],
      "properties": {
        "width": {
          "type": "number",
          "exclusiveMinimum": 0
        },
        "height": {
          "type": "number",
          "exclusiveMinimum": 0
        }
      }
    },
    "box3d": {
      "type": "object",
      "additionalProperties": false,
      "required": [
        "width",
        "height",
        "depth"
      ],
      "properties": {
        "width": {
          "type": "number",
          "exclusiveMinimum": 0
        },
        "height": {
          "type": "number",
          "exclusiveMinimum": 0
        },
        "depth": {
          "type": "number",
          "exclusiveMinimum": 0
        }
      }
    }
  }
}
