{
  "schema_version": "1.1",
  "project": {
    "id": "PN-AUT-01",
    "title": "Painel de Automação HVAC - CLP principal + VRF",
    "revision": "R02",
    "engineering_level": "BASIC",
    "standard_id": "AUT-PAINEL-COMPACT-V2.4"
  },
  "production_contract": {
    "golden_rules": [
      "GR-034",
      "GR-035",
      "GR-036",
      "GR-037",
      "GR-038",
      "GR-039",
      "GR-040",
      "GR-041",
      "GR-042",
      "GR-043",
      "GR-044",
      "GR-045"
    ],
    "li_before_bom": true,
    "li_is_quantity_source": true,
    "load_balance_before_layout": true,
    "bom_before_render": true,
    "bom_quantity_must_match_li": true,
    "layout_quantity_must_match_li": true,
    "image_must_match_li": true,
    "li_change_invalidates_bom_layout_image": true,
    "hmi_must_be_on_door": true,
    "li_file": "li/PN-AUT-01_LI.json",
    "quantity_registry": "datacenter/AUT_PANEL_PANEL_QUANTITIES.json",
    "document_standard_registry": "datacenter/AUT_PANEL_DOCUMENT_STANDARDS.json",
    "immutable_golden_rules_registry": "governance/golden_rules.yaml",
    "immutable_pipeline_registry": "pipeline/pipeline.yaml",
    "panel_template_registry": "templates/panel_template.yaml",
    "datacenter_yaml_registry": "datacenter/datacenter.yaml",
    "datasheet_yaml_registry": "datasheet/datasheet.yaml",
    "prompt_master_file": "prompts/PROMPT_MASTER_AUT_PANEL.md",
    "prompt_master_id": "PROMPT-MASTER-AUT-PANEL-V1",
    "workbook_template_id": "XLSX-PN-AUT-01-MASTER-R02",
    "workbook_structural_fingerprint_sha256": "c568858ed6d80cc2ccd4a8859d0a21f88cafddccc10737eda8808555b94530fc",
    "workbook_template_must_match_master": true,
    "image_visual_standard_id": "IMG-AUT-PANEL-MASTER-V1",
    "image_template_id": "IMG-PN-AUT-01-APPROVED-V1",
    "approved_image_sha256": "d5e5e060b1a68eb2f4d11a3e62a05040f0d91514c32c61669c4de03890b79402",
    "image_template_must_match_approved": true,
    "one_panel_per_image": true,
    "standard_change_requires_explicit_authorization": true,
    "normative_registry": "datacenter/AUT_PANEL_NORMATIVE_REFERENCES.yaml",
    "normative_memory": "memory/AUT_PANEL_NORMATIVE_MEMORY.yaml",
    "normative_registry_id": "AUT-PANEL-NORMATIVE-REFERENCES-V1",
    "normative_memory_id": "AUT-PANEL-NORMATIVE-MEMORY-V1",
    "normative_reverification_before_release": true,
    "normative_unverified_applicable_status": "HOLD"
  },
  "enclosure": {
    "catalog_id": "SCHNEIDER-NSYCRN86300",
    "manufacturer": "Schneider Electric",
    "family": "PanelSeT CRN",
    "model": "NSYCRN86300",
    "external_mm": {
      "width": 600,
      "height": 800,
      "depth": 300
    },
    "mounting_plate_mm": {
      "width": 550,
      "height": 750
    },
    "minimum_free_reserve_percent": 25,
    "ip_rating": "IP66",
    "ik_rating": null
  },
  "render": {
    "px_per_mm": 2,
    "single_global_scale": true,
    "aspect_equal": true,
    "allow_component_scale_override": false,
    "allow_stretch": false,
    "canvas_policy": "grow_only",
    "front_external_master_geometry": true,
    "visual_standard_id": "IMG-AUT-PANEL-MASTER-V1",
    "visual_template_id": "IMG-PN-AUT-01-APPROVED-V1",
    "one_panel_per_image": true,
    "approved_reference_layout_locked": true
  },
  "views": {
    "front_external_mm": {
      "width": 600,
      "height": 800
    },
    "front_internal_mm": {
      "width": 600,
      "height": 800
    },
    "side_external_mm": {
      "width": 300,
      "height": 800
    }
  },
  "layout": {
    "fixed_occupied_area_mm2": 90000,
    "bottom_zone": {
      "cable_exit_height_mm": 65,
      "lower_wireway_height_mm": 50,
      "minimum_bend_clearance_mm": 25,
      "terminal_zone_bottom_y_mm": 150,
      "cable_glands_count": 8
    }
  },
  "architecture": {
    "controller_type": "PLC",
    "controller_catalog_id": "SIEMENS-S7-1500-REF",
    "io_catalog_ids": [
      "SIEMENS-ET200SP-IM-REF",
      "SIEMENS-ET200SP-DI-REF",
      "SIEMENS-ET200SP-DQ-REF",
      "SIEMENS-ET200SP-AI-REF",
      "SIEMENS-ET200SP-RTD-REF"
    ],
    "protocols": [
      "Industrial Ethernet",
      "Modbus TCP",
      "VRF gateway"
    ]
  },
  "placements": [
    {
      "li_tag": "QF-01",
      "instance_id": "QF-01",
      "catalog_id": "SCHNEIDER-A9F74232-REF",
      "quantity": 1,
      "surface": "mounting_plate",
      "x_mm": 30,
      "y_mm": 675,
      "rotation_deg": 0
    },
    {
      "li_tag": "DPS-01",
      "instance_id": "DPS-01",
      "catalog_id": "SCHNEIDER-IPRD-REF",
      "quantity": 1,
      "surface": "mounting_plate",
      "x_mm": 80,
      "y_mm": 675,
      "rotation_deg": 0
    },
    {
      "li_tag": "PS-01",
      "instance_id": "PS-01",
      "catalog_id": "SCHNEIDER-ABL8RPS24100",
      "quantity": 1,
      "surface": "mounting_plate",
      "x_mm": 150,
      "y_mm": 675,
      "rotation_deg": 0
    },
    {
      "li_tag": "UPS-01",
      "instance_id": "UPS-01",
      "catalog_id": "ADEL-CBI2420A",
      "quantity": 1,
      "surface": "mounting_plate",
      "x_mm": 250,
      "y_mm": 600,
      "rotation_deg": 0
    },
    {
      "li_tag": "BAT-01A/B",
      "instance_id": "BAT-01A-B",
      "catalog_id": "BATTERY-12V12AH-VRLA-REF",
      "quantity": 2,
      "surface": "mounting_plate",
      "x_mm": 420,
      "y_mm": 600,
      "rotation_deg": 0
    },
    {
      "li_tag": "QF24-01..04",
      "instance_id": "QF24-01-04",
      "catalog_id": "SCHNEIDER-A9F74210-REF",
      "quantity": 4,
      "surface": "mounting_plate",
      "x_mm": 30,
      "y_mm": 470,
      "rotation_deg": 0
    },
    {
      "li_tag": "GW-01",
      "instance_id": "GW-01",
      "catalog_id": "TRANE-FIACNXYEKIT",
      "quantity": 1,
      "surface": "mounting_plate",
      "x_mm": 50,
      "y_mm": 320,
      "rotation_deg": 0
    },
    {
      "li_tag": "SW-01",
      "instance_id": "SW-01",
      "catalog_id": "SIEMENS-SCALANCE-X208-REF",
      "quantity": 1,
      "surface": "mounting_plate",
      "x_mm": 220,
      "y_mm": 320,
      "rotation_deg": 0
    },
    {
      "li_tag": "PLC-01",
      "instance_id": "PLC-01",
      "catalog_id": "SIEMENS-S7-1500-REF",
      "quantity": 1,
      "surface": "mounting_plate",
      "x_mm": 300,
      "y_mm": 320,
      "rotation_deg": 0
    },
    {
      "li_tag": "IM-01",
      "instance_id": "IM-01",
      "catalog_id": "SIEMENS-ET200SP-IM-REF",
      "quantity": 1,
      "surface": "mounting_plate",
      "x_mm": 360,
      "y_mm": 320,
      "rotation_deg": 0
    },
    {
      "li_tag": "DI-01",
      "instance_id": "DI-01",
      "catalog_id": "SIEMENS-ET200SP-DI-REF",
      "quantity": 1,
      "surface": "mounting_plate",
      "x_mm": 380,
      "y_mm": 320,
      "rotation_deg": 0
    },
    {
      "li_tag": "DO-01",
      "instance_id": "DO-01",
      "catalog_id": "SIEMENS-ET200SP-DQ-REF",
      "quantity": 1,
      "surface": "mounting_plate",
      "x_mm": 400,
      "y_mm": 320,
      "rotation_deg": 0
    },
    {
      "li_tag": "AI-01",
      "instance_id": "AI-01",
      "catalog_id": "SIEMENS-ET200SP-AI-REF",
      "quantity": 1,
      "surface": "mounting_plate",
      "x_mm": 420,
      "y_mm": 320,
      "rotation_deg": 0
    },
    {
      "li_tag": "RTD-01",
      "instance_id": "RTD-01",
      "catalog_id": "SIEMENS-ET200SP-RTD-REF",
      "quantity": 1,
      "surface": "mounting_plate",
      "x_mm": 440,
      "y_mm": 320,
      "rotation_deg": 0
    },
    {
      "li_tag": "KA-01..04",
      "instance_id": "KA-01-04",
      "catalog_id": "SCHNEIDER-HARMONY-RELAY-REF",
      "quantity": 4,
      "surface": "mounting_plate",
      "x_mm": 480,
      "y_mm": 320,
      "rotation_deg": 0
    },
    {
      "li_tag": "XT-01",
      "instance_id": "XT-01",
      "catalog_id": "PHOENIX-PT25-3209510",
      "quantity": 32,
      "surface": "mounting_plate",
      "x_mm": 30,
      "y_mm": 170,
      "rotation_deg": 0
    },
    {
      "li_tag": "XPE-01",
      "instance_id": "XPE-01",
      "catalog_id": "PHOENIX-PT25-PE-REF",
      "quantity": 8,
      "surface": "mounting_plate",
      "x_mm": 300,
      "y_mm": 170,
      "rotation_deg": 0
    },
    {
      "li_tag": "PE-01",
      "instance_id": "PE-01",
      "catalog_id": "PHOENIX-NB10-6-REF",
      "quantity": 1,
      "surface": "mounting_plate",
      "x_mm": 430,
      "y_mm": 170,
      "rotation_deg": 0
    },
    {
      "li_tag": "DIN-01..03",
      "instance_id": "DIN-01-03",
      "catalog_id": "PHOENIX-NS35-75-REF",
      "quantity": 3,
      "surface": "mounting_plate",
      "x_mm": 20,
      "y_mm": 100,
      "rotation_deg": 0
    },
    {
      "li_tag": "WD-01..05",
      "instance_id": "WD-01-05",
      "catalog_id": "AUT-DUCT-REF",
      "quantity": 5,
      "surface": "mounting_plate",
      "x_mm": 20,
      "y_mm": 80,
      "rotation_deg": 0
    },
    {
      "li_tag": "CG-01..08",
      "instance_id": "CG-01-08",
      "catalog_id": "SCHNEIDER-GLAND-REF",
      "quantity": 8,
      "surface": "mounting_plate",
      "x_mm": 20,
      "y_mm": 20,
      "rotation_deg": 0
    },
    {
      "li_tag": "HMI-01",
      "instance_id": "HMI-01",
      "catalog_id": "SCHNEIDER-HMIST6500",
      "quantity": 1,
      "surface": "door",
      "x_mm": 180,
      "y_mm": 500,
      "rotation_deg": 0
    }
  ],
  "normative_profile": {
    "baseline_group": "panel_general",
    "detected_conditions": [
      "industrial_network",
      "dc_ups_present",
      "spd_present"
    ],
    "conditional_group_review_required": true,
    "applicability_status": "HOLD_UNTIL_NORMATIVE_REVIEW",
    "note": "Condições detectadas apenas ativam revisão; aplicabilidade final e edição vigente devem ser validadas por fonte oficial antes da emissão."
  }
}
