{
  "schema_version": "1.1",
  "project": {
    "id": "PN-AUT-02",
    "title": "Painel de Automação HVAC - UTR remota + IHM",
    "revision": "R02",
    "engineering_level": "BASIC",
    "standard_id": "AUT-PAINEL-COMPACT-V2.4"
  },
  "production_contract": {
    "golden_rules": [
      "GR-034",
      "GR-035",
      "GR-036",
      "GR-037",
      "GR-038",
      "GR-039",
      "GR-040",
      "GR-041",
      "GR-042",
      "GR-043",
      "GR-044",
      "GR-045"
    ],
    "li_before_bom": true,
    "li_is_quantity_source": true,
    "load_balance_before_layout": true,
    "bom_before_render": true,
    "bom_quantity_must_match_li": true,
    "layout_quantity_must_match_li": true,
    "image_must_match_li": true,
    "li_change_invalidates_bom_layout_image": true,
    "hmi_must_be_on_door": true,
    "li_file": "li/PN-AUT-02_LI.json",
    "quantity_registry": "datacenter/AUT_PANEL_PANEL_QUANTITIES.json",
    "document_standard_registry": "datacenter/AUT_PANEL_DOCUMENT_STANDARDS.json",
    "immutable_golden_rules_registry": "governance/golden_rules.yaml",
    "immutable_pipeline_registry": "pipeline/pipeline.yaml",
    "panel_template_registry": "templates/panel_template.yaml",
    "datacenter_yaml_registry": "datacenter/datacenter.yaml",
    "datasheet_yaml_registry": "datasheet/datasheet.yaml",
    "prompt_master_file": "prompts/PROMPT_MASTER_AUT_PANEL.md",
    "prompt_master_id": "PROMPT-MASTER-AUT-PANEL-V1",
    "workbook_template_id": "XLSX-PN-AUT-01-MASTER-R02",
    "workbook_structural_fingerprint_sha256": "c568858ed6d80cc2ccd4a8859d0a21f88cafddccc10737eda8808555b94530fc",
    "workbook_template_must_match_master": true,
    "image_visual_standard_id": "IMG-AUT-PANEL-MASTER-V1",
    "image_template_id": "IMG-PN-AUT-02-APPROVED-V1",
    "approved_image_sha256": "daf6981a2efad57f0c54eafd7a2d71e42895d47932a3d9ddf5cfdc8918a84d89",
    "image_template_must_match_approved": true,
    "one_panel_per_image": true,
    "standard_change_requires_explicit_authorization": true,
    "normative_registry": "datacenter/AUT_PANEL_NORMATIVE_REFERENCES.yaml",
    "normative_memory": "memory/AUT_PANEL_NORMATIVE_MEMORY.yaml",
    "normative_registry_id": "AUT-PANEL-NORMATIVE-REFERENCES-V1",
    "normative_memory_id": "AUT-PANEL-NORMATIVE-MEMORY-V1",
    "normative_reverification_before_release": true,
    "normative_unverified_applicable_status": "HOLD"
  },
  "enclosure": {
    "catalog_id": "SCHNEIDER-NSYCRN54250",
    "manufacturer": "Schneider Electric",
    "family": "PanelSeT CRN",
    "model": "NSYCRN54250",
    "external_mm": {
      "width": 400,
      "height": 500,
      "depth": 250
    },
    "mounting_plate_mm": {
      "width": 350,
      "height": 450
    },
    "minimum_free_reserve_percent": 20,
    "ip_rating": "IP66",
    "ik_rating": null
  },
  "render": {
    "px_per_mm": 2,
    "single_global_scale": true,
    "aspect_equal": true,
    "allow_component_scale_override": false,
    "allow_stretch": false,
    "canvas_policy": "grow_only",
    "front_external_master_geometry": true,
    "visual_standard_id": "IMG-AUT-PANEL-MASTER-V1",
    "visual_template_id": "IMG-PN-AUT-02-APPROVED-V1",
    "one_panel_per_image": true,
    "approved_reference_layout_locked": true
  },
  "views": {
    "front_external_mm": {
      "width": 400,
      "height": 500
    },
    "front_internal_mm": {
      "width": 400,
      "height": 500
    },
    "side_external_mm": {
      "width": 250,
      "height": 500
    }
  },
  "layout": {
    "fixed_occupied_area_mm2": 35000,
    "bottom_zone": {
      "cable_exit_height_mm": 45,
      "lower_wireway_height_mm": 40,
      "minimum_bend_clearance_mm": 20,
      "terminal_zone_bottom_y_mm": 115,
      "cable_glands_count": 6
    }
  },
  "architecture": {
    "controller_type": "RTU",
    "controller_catalog_id": "SIEMENS-RTU-REF",
    "io_catalog_ids": [
      "SIEMENS-SM1221-DI-REF",
      "SIEMENS-SM1222-DO-REF",
      "SIEMENS-SM1231-AI-REF",
      "SIEMENS-SM1231-RTD-REF"
    ],
    "protocols": [
      "Industrial Ethernet",
      "Modbus TCP"
    ]
  },
  "placements": [
    {
      "li_tag": "QF-02",
      "instance_id": "QF-02",
      "catalog_id": "SCHNEIDER-A9F74210-REF",
      "quantity": 1,
      "surface": "mounting_plate",
      "x_mm": 20,
      "y_mm": 390,
      "rotation_deg": 0
    },
    {
      "li_tag": "PS-02",
      "instance_id": "PS-02",
      "catalog_id": "PULS-CPS241",
      "quantity": 1,
      "surface": "mounting_plate",
      "x_mm": 80,
      "y_mm": 390,
      "rotation_deg": 0
    },
    {
      "li_tag": "UPS-02",
      "instance_id": "UPS-02",
      "catalog_id": "ADEL-CBI2420A",
      "quantity": 1,
      "surface": "mounting_plate",
      "x_mm": 170,
      "y_mm": 330,
      "rotation_deg": 0
    },
    {
      "li_tag": "BAT-02A/B",
      "instance_id": "BAT-02A-B",
      "catalog_id": "BATTERY-12V12AH-VRLA-REF",
      "quantity": 2,
      "surface": "mounting_plate",
      "x_mm": 20,
      "y_mm": 330,
      "rotation_deg": 0
    },
    {
      "li_tag": "QF24-05..07",
      "instance_id": "QF24-05-07",
      "catalog_id": "SCHNEIDER-A9F74206-REF",
      "quantity": 3,
      "surface": "mounting_plate",
      "x_mm": 20,
      "y_mm": 245,
      "rotation_deg": 0
    },
    {
      "li_tag": "SW-02",
      "instance_id": "SW-02",
      "catalog_id": "SIEMENS-SCALANCE-X208-REF",
      "quantity": 1,
      "surface": "mounting_plate",
      "x_mm": 90,
      "y_mm": 245,
      "rotation_deg": 0
    },
    {
      "li_tag": "RTU-02",
      "instance_id": "RTU-02",
      "catalog_id": "SIEMENS-RTU-REF",
      "quantity": 1,
      "surface": "mounting_plate",
      "x_mm": 140,
      "y_mm": 245,
      "rotation_deg": 0
    },
    {
      "li_tag": "DI-02",
      "instance_id": "DI-02",
      "catalog_id": "SIEMENS-SM1221-DI-REF",
      "quantity": 1,
      "surface": "mounting_plate",
      "x_mm": 210,
      "y_mm": 245,
      "rotation_deg": 0
    },
    {
      "li_tag": "DO-02",
      "instance_id": "DO-02",
      "catalog_id": "SIEMENS-SM1222-DO-REF",
      "quantity": 1,
      "surface": "mounting_plate",
      "x_mm": 235,
      "y_mm": 245,
      "rotation_deg": 0
    },
    {
      "li_tag": "AI-02",
      "instance_id": "AI-02",
      "catalog_id": "SIEMENS-SM1231-AI-REF",
      "quantity": 1,
      "surface": "mounting_plate",
      "x_mm": 260,
      "y_mm": 245,
      "rotation_deg": 0
    },
    {
      "li_tag": "RTD-02",
      "instance_id": "RTD-02",
      "catalog_id": "SIEMENS-SM1231-RTD-REF",
      "quantity": 1,
      "surface": "mounting_plate",
      "x_mm": 285,
      "y_mm": 245,
      "rotation_deg": 0
    },
    {
      "li_tag": "KA-05..08",
      "instance_id": "KA-05-08",
      "catalog_id": "SCHNEIDER-HARMONY-RELAY-REF",
      "quantity": 4,
      "surface": "mounting_plate",
      "x_mm": 20,
      "y_mm": 145,
      "rotation_deg": 0
    },
    {
      "li_tag": "XT-02",
      "instance_id": "XT-02",
      "catalog_id": "PHOENIX-PT25-3209510",
      "quantity": 24,
      "surface": "mounting_plate",
      "x_mm": 90,
      "y_mm": 145,
      "rotation_deg": 0
    },
    {
      "li_tag": "XPE-02",
      "instance_id": "XPE-02",
      "catalog_id": "PHOENIX-PT25-PE-REF",
      "quantity": 6,
      "surface": "mounting_plate",
      "x_mm": 240,
      "y_mm": 145,
      "rotation_deg": 0
    },
    {
      "li_tag": "PE-02",
      "instance_id": "PE-02",
      "catalog_id": "PHOENIX-NB10-6-REF",
      "quantity": 1,
      "surface": "mounting_plate",
      "x_mm": 300,
      "y_mm": 145,
      "rotation_deg": 0
    },
    {
      "li_tag": "DIN-04..06",
      "instance_id": "DIN-04-06",
      "catalog_id": "PHOENIX-NS35-75-REF",
      "quantity": 3,
      "surface": "mounting_plate",
      "x_mm": 15,
      "y_mm": 90,
      "rotation_deg": 0
    },
    {
      "li_tag": "WD-06..10",
      "instance_id": "WD-06-10",
      "catalog_id": "AUT-DUCT-REF",
      "quantity": 5,
      "surface": "mounting_plate",
      "x_mm": 15,
      "y_mm": 70,
      "rotation_deg": 0
    },
    {
      "li_tag": "CG-09..14",
      "instance_id": "CG-09-14",
      "catalog_id": "SCHNEIDER-GLAND-REF",
      "quantity": 6,
      "surface": "mounting_plate",
      "x_mm": 15,
      "y_mm": 15,
      "rotation_deg": 0
    },
    {
      "li_tag": "HMI-02",
      "instance_id": "HMI-02",
      "catalog_id": "SCHNEIDER-HMIST6500",
      "quantity": 1,
      "surface": "door",
      "x_mm": 80,
      "y_mm": 300,
      "rotation_deg": 0
    }
  ],
  "normative_profile": {
    "baseline_group": "panel_general",
    "detected_conditions": [
      "industrial_network",
      "dc_ups_present"
    ],
    "conditional_group_review_required": true,
    "applicability_status": "HOLD_UNTIL_NORMATIVE_REVIEW",
    "note": "Condições detectadas apenas ativam revisão; aplicabilidade final e edição vigente devem ser validadas por fonte oficial antes da emissão."
  }
}
